id,genus,species,common_name,latitude,longitude,type,date,time,length,quality,remarks,sex,stage,also,file_name,local_file
179835,Oporornis,agilis,Connecticut Warbler,40.0723,-82.8736,song,2014-05-27,10:00,3:21,C,"Found around 6:45am by Doreen Linzell and Dan Sanders, this bird continued calling (infrequently) until at least 11:15am.  I made this recording around 10am while the bird moved through the understory at or near ground level just west of where the Brookside Trail intersects the Hickory Ridge Trail at Blendon Woods Metro Park.  The bird continued calling for a few minutes after the end of this recording (out of storage space! Argh!) and around 10:15 or so hopped up on some dead branches while foraging allowing myself and a half-dozen or so other birders a chance to get a look at him.  

Recorded using a Sennheiser ME67 shotgun mic and a Sony Hi-MD recorder, model MZ-RH910. Recording edited using Audacity to apply a high pass filter and do noise reduction. 

eBird Checklist: <http://ebird.org/ebird/view/checklist?subID=S18584007>",,,"Polioptila caerulea, Spinus tristis, Contopus virens, Chaetura pelagica, Hylocichla mustelina, Thryothorus ludovicianus, Vireo olivaceus, Dryobates pubescens, Cardinalis cardinalis",Oporornis_agilis_Blendon_Woods_Metro_Park--Brookside_Trail_near_Hickory_Ridge_Trail_Columbus_Franklin_County_Ohio_179835.mp3,Original Recordings\Oporornis_agilis_Blendon_Woods_Metro_Park--Brookside_Trail_near_Hickory_Ridge_Trail_Columbus_Franklin_County_Ohio_179835.mp3
179681,Geothlypis,philadelphia,Mourning Warbler,40.0168,-83.0435,song,2014-05-24,09:05,0:35,A,"Cropped from XC179679.  See XC179676 for a recording just prior to this one. Recorded along the southeast margin of the wood lot on the Ohio State University experimental farm (Waterman Farm; limited access) located in urban Columbus, OH adjacent to the OSU campus (see map). While recording a Canada Warbler in honey suckle bushes and adjacent lower branches of trees along the edge of the wood lot, a Mourning Warbler appeared lower in the same vegetation and joined the Canada Warbler's late morning singing.  All of this session's Mourning Warbler recordings: at the end of XC179676 and throughout XC179679 (XC179681 cropped from XC179679). All of this session's Canada Warbler recordings: XC179676, XC179679 (XC179681 cropped from XC179679), and XC179691. Audacity software was used for post-processing of recordings (signal:noise reduction via high pass filter, then amplification).  

eBird Checklist: <http://ebird.org/ebird/view/checklist?subID=S18532024>",,,"Corvus brachyrhynchos, Melospiza melodia, Cardellina canadensis, Haemorhous mexicanus, Molothrus ater, Turdus migratorius, Cardinalis cardinalis",Geothlypis_philadelphia_OSU's_Waterman_Farm_wood_lot_Columbus_Franklin_County_Ohio_179681.mp3,Original Recordings\Geothlypis_philadelphia_OSU's_Waterman_Farm_wood_lot_Columbus_Franklin_County_Ohio_179681.mp3
723382,Geothlypis,philadelphia,Mourning Warbler,39.1722,-84.643,song,2022-05-04,17:17,0:13,B,"Bird singing in dense honeysuckle along the edge of an asphalt path adjacent to residential and wooded corridor. Playback used only after recording made, in an attempt to lure the bird into view.",male,adult,"Dryobates pubescens, Cardinalis cardinalis, Cyanocitta cristata",Geothlypis_philadelphia_Green_Township_near__Cincinnati_Hamilton_County_Ohio_723382.mp3,Original Recordings\Geothlypis_philadelphia_Green_Township_near__Cincinnati_Hamilton_County_Ohio_723382.mp3
369829,Geothlypis,philadelphia,Mourning Warbler,41.0111,-81.514,song,2017-05-13,11:00,0:10,C,"Heard 3 times, originally at about 8 second intervals, but I trimmed out the empty space and other songs. There is another bird singing at the beginning over top of the first song, so I couldn't trim that one out. The second and third songs are easier to hear.",,,,Geothlypis_philadelphia_Ohio_near__Akron_Summit_County_Ohio_369829.mp3,Original Recordings\Geothlypis_philadelphia_Ohio_near__Akron_Summit_County_Ohio_369829.mp3
725314,Geothlypis,philadelphia,Mourning Warbler,41.9628,-82.5184,song,2022-05-14,8:03,0:01,D,,uncertain,adult,,Geothlypis_philadelphia_Point_Pelee_National_Park_Essex_County_Ontario_725314.mp3,Original Recordings\Geothlypis_philadelphia_Point_Pelee_National_Park_Essex_County_Ontario_725314.mp3
417604,Geothlypis,formosa,Kentucky Warbler,38.7414,-83.1977,song,2018-05-06,12:31,0:04,A,,,,,Geothlypis_formosa_Shawnee_State_Park_Scioto_County_Ohio_417604.mp3,Original Recordings\Geothlypis_formosa_Shawnee_State_Park_Scioto_County_Ohio_417604.mp3
417461,Geothlypis,formosa,Kentucky Warbler,38.7047,-83.1429,song,2018-05-05,08:30,0:04,A,,,,,Geothlypis_formosa_Shawnee_State_Forest_Scioto_County_Ohio_417461.mp3,Original Recordings\Geothlypis_formosa_Shawnee_State_Forest_Scioto_County_Ohio_417461.mp3
417459,Geothlypis,formosa,Kentucky Warbler,38.7047,-83.1429,song,2018-05-05,08:30,0:48,A,,,,,Geothlypis_formosa_Shawnee_State_Forest_Scioto_County_Ohio_417459.mp3,Original Recordings\Geothlypis_formosa_Shawnee_State_Forest_Scioto_County_Ohio_417459.mp3
417458,Geothlypis,formosa,Kentucky Warbler,38.7047,-83.1429,song,2018-05-05,08:30,0:04,A,,,,,Geothlypis_formosa_Shawnee_State_Forest_Scioto_County_Ohio_417458.mp3,Original Recordings\Geothlypis_formosa_Shawnee_State_Forest_Scioto_County_Ohio_417458.mp3
910509,Geothlypis,formosa,Kentucky Warbler,39.2432,-84.7609,song,2024-06-04,09:35,0:46,B,Bird heard while watching a Hooded Warbler. This is not the same bird that was photographed on other side of access road. Habitat is mature deciduous woodland with dense semi-open understory of saplings.,male,adult,"Contopus virens, Hylocichla mustelina, Turdus migratorius, Vireo olivaceus, Setophaga citrina, Dryobates pubescens, Dryocopus pileatus",Geothlypis_formosa_Whitewater_Township_near__Cleves_Hamilton_County_Ohio_910509.mp3,Original Recordings\Geothlypis_formosa_Whitewater_Township_near__Cleves_Hamilton_County_Ohio_910509.mp3
817715,Geothlypis,formosa,Kentucky Warbler,39.2432,-84.7609,"call, song",2023-07-18,10:03,0:38,B,Female calling from mature forest low within dense understory while male sings in the background.,"female, male",adult,"Contopus virens, Hylocichla mustelina",Geothlypis_formosa_Whitewater_Township_near__Cleves_Hamilton_County_Ohio_817715.mp3,Original Recordings\Geothlypis_formosa_Whitewater_Township_near__Cleves_Hamilton_County_Ohio_817715.mp3
817714,Geothlypis,formosa,Kentucky Warbler,39.2432,-84.7609,call,2023-07-18,10:00,1:00,B,Female calling from low dense understory in mature forest.,female,adult,"Contopus virens, Hylocichla mustelina",Geothlypis_formosa_Whitewater_Township_near__Cleves_Hamilton_County_Ohio_817714.mp3,Original Recordings\Geothlypis_formosa_Whitewater_Township_near__Cleves_Hamilton_County_Ohio_817714.mp3
803620,Geothlypis,formosa,Kentucky Warbler,41.5434,-83.8394,song,2023-05-15,09:30,1:24,B,,male,,,Geothlypis_formosa_Oak_Openings_Lucas_County_Ohio_803620.mp3,Original Recordings\Geothlypis_formosa_Oak_Openings_Lucas_County_Ohio_803620.mp3
726820,Geothlypis,formosa,Kentucky Warbler,39.2453,-84.7581,call,2022-05-11,13:33,0:15,B,Bird in Tulip Tree right in front of me giving sharp metallic chip notes. Tallgrass Prairie Trail. Mature deciduous woodland with Sugar Maple dominating.,male,adult,Setophaga citrina,Geothlypis_formosa_Harrison_Township_near__Harrison_Hamilton_County_Ohio_726820.mp3,Original Recordings\Geothlypis_formosa_Harrison_Township_near__Harrison_Hamilton_County_Ohio_726820.mp3
103881,Geothlypis,formosa,Kentucky Warbler,40.073,-82.874,song,2012-06-17,11:45am,2:08,B,"This is a clip from the (8min) unedited track at http://soundcloud.com/paul-j-hurtado/kentucky-warbler-17june2012. Recorded at Blendon Woods metro park, Columbus OH on Sunday, 17 June 2012 around 11:45am using a Sennheiser ME67 shotgun mic and a Sony Hi-MD recorder, model MZ-RH910.  This individual was in a wooded area with some open canopy and sunlit groundcover. Lots of low woody shrubs and small saplings.  The bird stayed low (< 6 feet) in relatively thick vegetation, and moved approximately 40 feet through the bushes and understory during the recording period.  Presumably the bird was foraging. A singing male has been present in this area for a few weeks now, so this bird has at least attempted to nest in the area.  Insect noise and low frequency noisefiltered out using Audacity using a notch filter at 5.9kHz and a high pass filter cutoff around 1.6kHz.",,,,Geothlypis_formosa_Columbus_OH--Blendon_Woods_Metro_Park--Hickory_Ridge_Trail_between_Brookside_and_Overlook_Trails_103881.mp3,Original Recordings\Geothlypis_formosa_Columbus_OH--Blendon_Woods_Metro_Park--Hickory_Ridge_Trail_between_Brookside_and_Overlook_Trails_103881.mp3
31280,Geothlypis,formosa,Kentucky Warbler,41.8778,-83.6853,song,2008-06-02,09:00,0:52,B,Vagrant to this area.,,,"Passerina cyanea, Cardinalis cardinalis",Geothlypis_formosa_Michigan_Petersburg_SGA__31280.mp3,Original Recordings\Geothlypis_formosa_Michigan_Petersburg_SGA__31280.mp3
728265,Geothlypis,formosa,Kentucky Warbler,39.2453,-84.7581,song,2022-05-24,15:22,0:43,C,"Somewhat distant bird singing from moderately dense understory of hickory, maple and oak in mature deciduous forest.",male,adult,"Melanerpes carolinus, Molothrus ater, Turdus migratorius, Vireo olivaceus",Geothlypis_formosa_Harrison_Township_near__Harrison_Hamilton_County_Ohio_728265.mp3,Original Recordings\Geothlypis_formosa_Harrison_Township_near__Harrison_Hamilton_County_Ohio_728265.mp3
828478,Geothlypis,trichas,Common Yellowthroat,41.6275,-83.1897,song,2023-05-16,08:37,1:25,A,,male,adult,"Agelaius phoeniceus, Setophaga aestiva, Branta canadensis, Turdus migratorius",Geothlypis_trichas_Magee_Marsh_-_boardwalk_Lucas_County_Ohio_828478.mp3,Original Recordings\Geothlypis_trichas_Magee_Marsh_-_boardwalk_Lucas_County_Ohio_828478.mp3
803583,Geothlypis,trichas,Common Yellowthroat,41.9501,-82.5237,song,2023-05-16,13:23,0:26,A,,male,adult,,Geothlypis_trichas_Point_Pelee_National_Park_near__Wheatley_Essex_County_Ontario_803583.mp3,Original Recordings\Geothlypis_trichas_Point_Pelee_National_Park_near__Wheatley_Essex_County_Ontario_803583.mp3
726806,Geothlypis,trichas,Common Yellowthroat,39.2095,-84.7821,song,2022-05-11,11:22,0:55,A,Bird singing from about eye level in sycamore adjacent to old field with lots of shrubs along a small lake. ,male,adult,"Agelaius phoeniceus, Setophaga aestiva, Melospiza melodia, Spinus tristis, Baeolophus bicolor, Tachycineta bicolor, Empidonax traillii, Cardinalis cardinalis, Icterus galbula, Ardea herodias",Geothlypis_trichas_Whitewater_Township_near__Harrison_Hamilton_County_Ohio_726806.mp3,Original Recordings\Geothlypis_trichas_Whitewater_Township_near__Harrison_Hamilton_County_Ohio_726806.mp3
646029,Geothlypis,trichas,Common Yellowthroat,39.1317,-84.7973,song,2021-04-30,10:36,0:42,A,Male singing along roadside. Another bird singing further away. Brushy right-of-way.,male,adult,"Icteria virens, Setophaga ruticilla, Pipilo erythrophthalmus, Vireo olivaceus, Vireo griseus, Setophaga cerulea",Geothlypis_trichas_Miami_Township_near__North_Bend_Hamilton_County_Ohio_646029.mp3,Original Recordings\Geothlypis_trichas_Miami_Township_near__North_Bend_Hamilton_County_Ohio_646029.mp3
417980,Geothlypis,trichas,Common Yellowthroat,40.5652,-83.6255,song,2018-05-06,12:15,0:02,A,Natural vocalizations from the boardwalk.,,,,Geothlypis_trichas_Lawrence_Woods_SNP_417980.mp3,Original Recordings\Geothlypis_trichas_Lawrence_Woods_SNP_417980.mp3
416558,Geothlypis,trichas,Common Yellowthroat,39.017,-84.1259,song,2018-05-03,11:50,0:03,B,In tall wet grass,,,,Geothlypis_trichas_East_Fork_Lake_SP_Clermont_County_Ohio_416558.mp3,Original Recordings\Geothlypis_trichas_East_Fork_Lake_SP_Clermont_County_Ohio_416558.mp3
737240,Geothlypis,trichas,Common Yellowthroat,39.919,-83.2065,song,2022-05-08,10:52,0:07,C,Natural vocalization from cattails around a pond,male,adult,Agelaius phoeniceus,Geothlypis_trichas_Battelle_Darby_Metro_Park_-_Wetlands_737240.mp3,Original Recordings\Geothlypis_trichas_Battelle_Darby_Metro_Park_-_Wetlands_737240.mp3
374227,Geothlypis,trichas,Common Yellowthroat,41.1895,-81.5781,song,2017-06-07,07:30,0:30,E,,,,"Melanerpes carolinus, Contopus virens, Baeolophus bicolor, Turdus migratorius, Dryobates pubescens",Geothlypis_trichas_Ohio_near__Peninsula_Summit_County_Ohio_374227.mp3,Original Recordings\Geothlypis_trichas_Ohio_near__Peninsula_Summit_County_Ohio_374227.mp3
910499,Setophaga,citrina,Hooded Warbler,39.2432,-84.7609,song,2024-06-04,09:10,0:24,A,Male moving about actively in mid to upper levels of hickories and maples in response to playback. Habitat is mature deciduous woodland with dense semi-open understory of saplings.,male,adult,"Sitta carolinensis, Hylocichla mustelina, Vireo olivaceus, Dryobates pubescens",Setophaga_citrina_Whitewater_Township_near__Cleves_Hamilton_County_Ohio_910499.mp3,Original Recordings\Setophaga_citrina_Whitewater_Township_near__Cleves_Hamilton_County_Ohio_910499.mp3
726821,Setophaga,citrina,Hooded Warbler,39.2453,-84.7581,song,2022-05-11,13:33,0:23,A,"Bird very close, singing from bare branch mid level in mature deciduous forest with dense understory. Sugar Maple is a dominant species.",male,adult,"Leiothlypis peregrina, Melanerpes carolinus, Hylocichla mustelina",Setophaga_citrina_Harrison_Township_near__Harrison_Hamilton_County_Ohio_726821.mp3,Original Recordings\Setophaga_citrina_Harrison_Township_near__Harrison_Hamilton_County_Ohio_726821.mp3
652287,Setophaga,citrina,Hooded Warbler,41.3144,-81.5996,song,2021-05-26,09:30,1:15,C,"I'm told the range from 8 kHz to 14 kHz is suppressed--maybe something about my phone or the recording app I used.

Oak-beech-maple forest.  I'm interested in the buzzing sounds--weet weet, weet weet weet--but I'd be happy with any identifications.  I'm not sure the buzzes are birds.  There seemed to be two things making them.",,adult,"Contopus virens, Cyanocitta cristata",Setophaga_citrina_Brecksville_Cuyahoga_County_Ohio_652287.mp3,Original Recordings\Setophaga_citrina_Brecksville_Cuyahoga_County_Ohio_652287.mp3
825241,Setophaga,ruticilla,American Redstart,41.6275,-83.1897,song,2023-05-15,08:10,4:45,A,adult male; singing while foraging; migrant; ,male,adult,"Agelaius phoeniceus, Zenaida macroura",Setophaga_ruticilla_Magee_Marsh_-_boardwalk_Lucas_County_Ohio_825241.mp3,Original Recordings\Setophaga_ruticilla_Magee_Marsh_-_boardwalk_Lucas_County_Ohio_825241.mp3
645905,Setophaga,ruticilla,American Redstart,39.1317,-84.7973,song,2021-04-30,11:01,0:40,A,Male singing along trail within 2 m or so of me.,male,adult,"Corvus brachyrhynchos, Polioptila caerulea, Pipilo erythrophthalmus, Setophaga americana, Setophaga cerulea, Cardinalis cardinalis",Setophaga_ruticilla_Miami_Township_near__North_Bend_Hamilton_County_Ohio_645905.mp3,Original Recordings\Setophaga_ruticilla_Miami_Township_near__North_Bend_Hamilton_County_Ohio_645905.mp3
476493,Setophaga,ruticilla,American Redstart,41.9112,-82.5091,song,2019-05-17,11:00,0:30,A,,,,,Setophaga_ruticilla_Pelee_near__Leamington_Essex_County_Ontario_476493.mp3,Original Recordings\Setophaga_ruticilla_Pelee_near__Leamington_Essex_County_Ontario_476493.mp3
178310,Setophaga,ruticilla,American Redstart,41.1449,-81.0854,song,2014-05-09,09:30,0:49,A,Recorded while bird was in a tree 50 feet away using an Amplified Wildtronics Parabolic Microphone and a Tascam DR-05 recorder. The only processing was a 200Hz low cut filter. ,,,,Setophaga_ruticilla_Paris_near__Ravenna_Portage_County_Ohio_178310.mp3,Original Recordings\Setophaga_ruticilla_Paris_near__Ravenna_Portage_County_Ohio_178310.mp3
83534,Setophaga,ruticilla,American Redstart,41.937,-82.51,song,2008-05-19,?,0:32,A,,,,,Setophaga_ruticilla_Point_Pelee_ON_83534.mp3,Original Recordings\Setophaga_ruticilla_Point_Pelee_ON_83534.mp3
825242,Setophaga,ruticilla,American Redstart,41.6275,-83.1897,subsong,2023-05-16,09:18,2:24,B,"one-year-old male migrant singing, some of the cleaner songs after 1:25; (as ""adult"" above versus juvenile)",male,adult,"Agelaius phoeniceus, Setophaga aestiva, Hylocichla mustelina, Vireo gilvus, Dumetella carolinensis",Setophaga_ruticilla_Magee_Marsh_-_boardwalk_Lucas_County_Ohio_825242.mp3,Original Recordings\Setophaga_ruticilla_Magee_Marsh_-_boardwalk_Lucas_County_Ohio_825242.mp3
825240,Setophaga,ruticilla,American Redstart,41.6275,-83.1897,song,2023-05-15,06:51,3:48,B,adult male; migrant;,male,adult,"Agelaius phoeniceus, Setophaga aestiva, Geothlypis trichas, Vireo gilvus, Icterus galbula",Setophaga_ruticilla_Magee_Marsh_-_boardwalk_Lucas_County_Ohio_825240.mp3,Original Recordings\Setophaga_ruticilla_Magee_Marsh_-_boardwalk_Lucas_County_Ohio_825240.mp3
418300,Setophaga,ruticilla,American Redstart,41.6122,-83.1723,song,2018-05-09,7:15,0:08,B,Natural vocalization. Same bird as in  XC418298,,,,Setophaga_ruticilla_Magee_Marsh_Ohio_418300.mp3,Original Recordings\Setophaga_ruticilla_Magee_Marsh_Ohio_418300.mp3
418298,Setophaga,ruticilla,American Redstart,41.6122,-83.1723,song,2018-05-09,7:15,0:29,B,Natural vocalization,,,,Setophaga_ruticilla_Magee_Marsh_Ohio_418298.mp3,Original Recordings\Setophaga_ruticilla_Magee_Marsh_Ohio_418298.mp3
417456,Setophaga,ruticilla,American Redstart,38.7047,-83.1429,song,2018-05-05,08:20,0:48,B,,,,"Baeolophus bicolor, Setophaga discolor, Vireo olivaceus, Setophaga cerulea",Setophaga_ruticilla_Shawnee_State_Forest_Scioto_County_Ohio_417456.mp3,Original Recordings\Setophaga_ruticilla_Shawnee_State_Forest_Scioto_County_Ohio_417456.mp3
417443,Setophaga,ruticilla,American Redstart,38.7047,-83.1429,song,2018-05-05,07:20,0:04,C,,,,,Setophaga_ruticilla_Shawnee_State_Forest_Scioto_County_Ohio_417443.mp3,Original Recordings\Setophaga_ruticilla_Shawnee_State_Forest_Scioto_County_Ohio_417443.mp3
103387,Setophaga,kirtlandii,Kirtland's Warbler,39.998,-83.034,flight call,2011-05-04,7:45pm,0:01,B,"Male Kirtland's Warbler flight note, one of two given just after the bird flew from a small redbud tree in front of a house on Hess Rd. near Kinnear Rd. in Columbus, OH.  Recorded between approx. 7:30-8:00pm on May 4, 2011. The recording was made using a Sennheiser ME67 shotgun mic and a Sony Hi-MD recorder, model MZ-RH910.  Post-processing via Raven Lite. Download *.wav at http://soundcloud.com/paul-j-hurtado/kiwa-flight-call-4may2011  Song from thi individual at http://www.xeno-canto.org/103394",,,,Setophaga_kirtlandii_Kinnear_Rd_&_Hess_Blvd_Columbus_OH_103387.mp3,Original Recordings\Setophaga_kirtlandii_Kinnear_Rd_&_Hess_Blvd_Columbus_OH_103387.mp3
103394,Setophaga,kirtlandii,Kirtland's Warbler,39.998,-83.034,song,2011-05-06,10:00am,2:30,C,"Male Kirtland's Warbler singing from about 25 feet up an Elm tree along Kinnear Rd. in Columbus, OH near the intersection of Kinnear Rd. and Hess Rd.  Recorded around 10am on May 6, 2011.  The recording was made using a Sennheiser ME67 shotgun mic and a Sony Hi-MD recorder, model MZ-RH910.  The recording includes lots of traffic noise, some squeaky brakes, voices from a small group of birders standing about 30 yards away, a slight breeze, and vocalizations from other bird species present (House Finch, House Sparrow, American Goldfinch, Yellow Warbler and possibly Northern Cardinal). DOWNLOAD longer *.wav version of this recording at http://soundcloud.com/paul-j-hurtado/kirtlands-columbus-2011  eBird Checklist: http://ebird.org/ebird/view/checklist?subID=S8186829 Flight Call from this individual at http://www.xeno-canto.org/103387",,,"Spinus tristis, Haemorhous mexicanus, Cardinalis cardinalis, Passer domesticus",Setophaga_kirtlandii_Kinnear_Rd_&_Hess_Blvd_Columbus_OH_103394.mp3,Original Recordings\Setophaga_kirtlandii_Kinnear_Rd_&_Hess_Blvd_Columbus_OH_103394.mp3
418096,Setophaga,tigrina,Cape May Warbler,41.6122,-83.1723,song,2018-05-08,7:55,0:02,A,Natural vocalization. Same bird as  XC418094,,,,Setophaga_tigrina_Magee_Marsh_Ohio_418096.mp3,Original Recordings\Setophaga_tigrina_Magee_Marsh_Ohio_418096.mp3
418094,Setophaga,tigrina,Cape May Warbler,41.6122,-83.1723,song,2018-05-08,7:55,0:25,A,Natural vocalization,,,,Setophaga_tigrina_Magee_Marsh_Ohio_418094.mp3,Original Recordings\Setophaga_tigrina_Magee_Marsh_Ohio_418094.mp3
44424,Setophaga,tigrina,Cape May Warbler,39.192,-84.555,song,2001-05-28,10:15,0:16,A,,,,"Passerina cyanea, Turdus migratorius, Vireo olivaceus",Setophaga_tigrina_Tanglewood_Lane_Cincinnati_Ohio_44424.mp3,Original Recordings\Setophaga_tigrina_Tanglewood_Lane_Cincinnati_Ohio_44424.mp3
44423,Setophaga,tigrina,Cape May Warbler,39.192,-84.555,song,2004-04-30,19:00,0:21,A,,,,,Setophaga_tigrina_Tanglewood_Lane_Cincinnati_Ohio_44423.mp3,Original Recordings\Setophaga_tigrina_Tanglewood_Lane_Cincinnati_Ohio_44423.mp3
17040,Setophaga,tigrina,Cape May Warbler,41.62116,-83.16103,song,2007-05-02,?,0:07,C,,,,"Agelaius phoeniceus, Setophaga aestiva",Setophaga_tigrina_Ohio_Crane_Creek_SP_17040.mp3,Original Recordings\Setophaga_tigrina_Ohio_Crane_Creek_SP_17040.mp3
417450,Setophaga,cerulea,Cerulean Warbler,38.7047,-83.1429,song,2018-05-05,07:40,0:04,A,,,,,Setophaga_cerulea_Shawnee_State_Forest_Scioto_County_Ohio_417450.mp3,Original Recordings\Setophaga_cerulea_Shawnee_State_Forest_Scioto_County_Ohio_417450.mp3
417448,Setophaga,cerulea,Cerulean Warbler,38.7047,-83.1429,song,2018-05-05,07:40,0:52,A,,,,"Corvus brachyrhynchos, Spinus tristis, Setophaga dominica",Setophaga_cerulea_Shawnee_State_Forest_Scioto_County_Ohio_417448.mp3,Original Recordings\Setophaga_cerulea_Shawnee_State_Forest_Scioto_County_Ohio_417448.mp3
646112,Setophaga,cerulea,Cerulean Warbler,39.1317,-84.7973,song,2021-04-30,11:01,0:17,B,Recording trimmed due to truck noise. Bird sang more than three phrases. Deciduous woodland.,male,adult,"Polioptila caerulea, Pipilo erythrophthalmus, Baeolophus bicolor, Hylocichla mustelina",Setophaga_cerulea_Miami_Township_near__North_Bend_Hamilton_County_Ohio_646112.mp3,Original Recordings\Setophaga_cerulea_Miami_Township_near__North_Bend_Hamilton_County_Ohio_646112.mp3
417453,Setophaga,cerulea,Cerulean Warbler,38.7047,-83.1429,song,2018-05-05,07:50,0:20,B,,,,"Vireo flavifrons, Baeolophus bicolor",Setophaga_cerulea_Shawnee_State_Forest_Scioto_County_Ohio_417453.mp3,Original Recordings\Setophaga_cerulea_Shawnee_State_Forest_Scioto_County_Ohio_417453.mp3
417983,Setophaga,cerulea,Cerulean Warbler,40.5652,-83.6255,song,2018-05-06,12:20,0:03,C,Natural vocalizations from the boardwalk.,,,,Setophaga_cerulea_Lawrence_Woods_SNP_417983.mp3,Original Recordings\Setophaga_cerulea_Lawrence_Woods_SNP_417983.mp3
839515,Setophaga,americana,Northern Parula,41.9355,-82.5109,song,2023-05-17,16:00,0:08,A,,,,Turdus migratorius,Setophaga_americana_Point_Pelee_National_Park_near__Wheatley_Essex_County_Ontario_839515.mp3,Original Recordings\Setophaga_americana_Point_Pelee_National_Park_near__Wheatley_Essex_County_Ontario_839515.mp3
825110,Setophaga,americana,Northern Parula,41.6275,-83.1897,song,2023-05-15,08:59,0:07,A,one song from a migrant;,male,adult,,Setophaga_americana_Magee_Marsh_-_boardwalk_Lucas_County_Ohio_825110.mp3,Original Recordings\Setophaga_americana_Magee_Marsh_-_boardwalk_Lucas_County_Ohio_825110.mp3
807351,Setophaga,americana,Northern Parula,39.2535,-84.763,song,2023-04-18,08:46,0:50,A,Male singing from treetops at forest edge near stream.,male,adult,"Pipilo erythrophthalmus, Spinus tristis, Melanerpes carolinus, Baeolophus bicolor, Turdus migratorius, Zonotrichia albicollis, Cardinalis cardinalis",Setophaga_americana_Tanager_Meadow_Reservable_Shelter_near__Harrison_Hamilton_County_Ohio_807351.mp3,Original Recordings\Setophaga_americana_Tanager_Meadow_Reservable_Shelter_near__Harrison_Hamilton_County_Ohio_807351.mp3
645550,Setophaga,americana,Northern Parula,39.1914,-84.7174,song,2021-04-26,09:18,0:38,A,Bird singing from high in pines.,male,adult,"Pipilo erythrophthalmus, Spinus tristis, Melanerpes carolinus, Baeolophus bicolor, Spizella passerina",Setophaga_americana_Miami_Township_near__Cleves_Hamilton_County_Ohio_645550.mp3,Original Recordings\Setophaga_americana_Miami_Township_near__Cleves_Hamilton_County_Ohio_645550.mp3
476949,Setophaga,americana,Northern Parula,41.9669,-82.5324,"drumming, song",2019-05-17,15:00,0:09,A,,,,Setophaga aestiva,Setophaga_americana_Pelee_near__Leamington_Essex_County_Ontario_476949.mp3,Original Recordings\Setophaga_americana_Pelee_near__Leamington_Essex_County_Ontario_476949.mp3
418297,Setophaga,americana,Northern Parula,41.6122,-83.1723,song,2018-05-09,7:15,0:04,A,Natural vocalization,,,,Setophaga_americana_Magee_Marsh_Ohio_418297.mp3,Original Recordings\Setophaga_americana_Magee_Marsh_Ohio_418297.mp3
545784,Setophaga,americana,Northern Parula,39.1278,-84.7987,song,2020-04-14,09:30,0:47,B,,uncertain,adult,Pipilo erythrophthalmus,Setophaga_americana_Miami_near__North_Bend_Hamilton_County_Ohio_545784.mp3,Original Recordings\Setophaga_americana_Miami_near__North_Bend_Hamilton_County_Ohio_545784.mp3
418004,Setophaga,americana,Northern Parula,41.6122,-83.1723,song,2018-05-07,7:10,0:04,B,Sing from a deciduous tree seen from the boardwalk.,,,,Setophaga_americana_Magee_Marsh_Ohio_418004.mp3,Original Recordings\Setophaga_americana_Magee_Marsh_Ohio_418004.mp3
372023,Setophaga,americana,Northern Parula,41.4885,-81.5787,song,2017-05-15,08:30,0:11,C,The recording has been cropped.  The bird was high in a shade tree at Shaker Lakes park.  Can anyone identify the rising buzzy sound at 2.5 and 9.5 sec?,,,,Setophaga_americana_Ohio_near__Cleveland_Heights_Cuyahoga_County_Ohio_372023.mp3,Original Recordings\Setophaga_americana_Ohio_near__Cleveland_Heights_Cuyahoga_County_Ohio_372023.mp3
