id,genus,species,common_name,latitude,longitude,type,date,time,length,quality,remarks,sex,stage,also,file_name,local_file
726750,Branta,canadensis,Canada Goose,39.2095,-84.7821,flight call,2022-05-11,11:22,0:14,A,Flock of 5 landing on lake.,uncertain,adult,"Agelaius phoeniceus, Melospiza melodia, Cardinalis cardinalis",Branta_canadensis_Whitewater_Township_near__Harrison_Hamilton_County_Ohio_726750.mp3,Original Recordings\Branta_canadensis_Whitewater_Township_near__Harrison_Hamilton_County_Ohio_726750.mp3
418000,Branta,canadensis,Canada Goose,40.5652,-83.6255,flight call,2018-05-06,13:10,0:31,A,Natural vocalizations as the birds flew overhead near the boardwalk.,,,"Myiarchus crinitus, Quiscalus quiscula",Branta_canadensis_Lawrence_Woods_SNP_418000.mp3,Original Recordings\Branta_canadensis_Lawrence_Woods_SNP_418000.mp3
691528,Branta,canadensis,Canada Goose,39.283,-84.7459,flight call,2021-12-14,07:48,0:19,B,"Part of large flock (total count 124 birds) taking off from the marsh and flying over the trees. Some veered off away from recordist, but others came quite close.",,,,Branta_canadensis_Miami_Whitewater_Forest_Park_wetlands_Crosby_Township_near__Harrison_Hamilton_County_Ohio_691528.mp3,Original Recordings\Branta_canadensis_Miami_Whitewater_Forest_Park_wetlands_Crosby_Township_near__Harrison_Hamilton_County_Ohio_691528.mp3
713788,Cygnus,buccinator,Trumpeter Swan,40.7095,-83.3032,call,2021-12-03,09:00,2:12,B,About 100m away in marshy pond. Numerous individuals.,,,,Cygnus_buccinator_Killdeer_Plains_Wildlife_Management_Area_Wyandot_County_Ohio_713788.mp3,Original Recordings\Cygnus_buccinator_Killdeer_Plains_Wildlife_Management_Area_Wyandot_County_Ohio_713788.mp3
815809,Aix,sponsa,Wood Duck,41.6275,-83.1897,call,2023-05-16,08:29,0:04,C,calls from two birds in flight;,uncertain,adult,,Aix_sponsa_Magee_Marsh_-_boardwalk_Lucas_County_Ohio_815809.mp3,Original Recordings\Aix_sponsa_Magee_Marsh_-_boardwalk_Lucas_County_Ohio_815809.mp3
855312,Anas,acuta,Northern Pintail,39.176,-84.528,call,2023-12-13,16:45,0:17,B,Bird feeding and calling among Mallards (Anas platyrhynchos) in lake. No other pintails found in immediate vicinity. Giving head bob display during call  - link to video on Macaulay Library: eBird).https://macaulaylibrary.org/asset/612202839,male,adult,Cyanocitta cristata,Anas_acuta_Cincinnati_Hamilton_County_Ohio_855312.mp3,Original Recordings\Anas_acuta_Cincinnati_Hamilton_County_Ohio_855312.mp3
805814,Colinus,virginianus,Northern Bobwhite,39.1833,-83.7177,"song, crickets",2023-05-27,17:34,0:59,A,"Bird singing from cover in a short grass field with scattered mixed trees and shrubs (coniferous and deciduous) near a lake. 
Bird seen briefly after calling when it flew across the road into dense ground cover under dense shrubbery.",male,adult,"Agelaius phoeniceus, Turdus migratorius, Quiscalus quiscula, Zenaida macroura, Charadrius vociferus, Sturnella magna",Colinus_virginianus_New_Market_Township_near__Hoagland_Highland_County_Ohio_805814.mp3,Original Recordings\Colinus_virginianus_New_Market_Township_near__Hoagland_Highland_County_Ohio_805814.mp3
17130,Colinus,virginianus,Northern Bobwhite,41.93338,-83.54994,song,2007-07-18,?,0:20,B,,,,"Spinus tristis, Passerina cyanea, Turdus migratorius",Colinus_virginianus_Michigan_Monroe_County_17130.mp3,Original Recordings\Colinus_virginianus_Michigan_Monroe_County_17130.mp3
17061,Colinus,virginianus,Northern Bobwhite,41.93338,-83.54994,song,2007-06-05,?,0:03,C,,,,,Colinus_virginianus_Michigan_Monroe_County_17061.mp3,Original Recordings\Colinus_virginianus_Michigan_Monroe_County_17061.mp3
17060,Colinus,virginianus,Northern Bobwhite,41.93338,-83.54994,song,2007-06-05,?,0:02,C,,,,,Colinus_virginianus_Michigan_Monroe_County_17060.mp3,Original Recordings\Colinus_virginianus_Michigan_Monroe_County_17060.mp3
16976,Phasianus,colchicus,Common Pheasant,41.93338,-83.54994,call,2007-05-07,?,0:03,B,,male,,,Phasianus_colchicus_Michigan_Monroe_County_16976.mp3,Original Recordings\Phasianus_colchicus_Michigan_Monroe_County_16976.mp3
647199,Chordeiles,minor,Common Nighthawk,39.1196,-84.5989,call,2021-05-09,00:08,1:06,B,"Bird calling after dark. Overcast, mist. Traffic noise reduced with noise reduction editing.",uncertain,adult,,Chordeiles_minor_Green_Township_near__Cincinnati_Hamilton_County_Ohio_647199.mp3,Original Recordings\Chordeiles_minor_Green_Township_near__Cincinnati_Hamilton_County_Ohio_647199.mp3
804643,Antrostomus,carolinensis,Chuck-will's-widow,38.7484,-83.4636,song,2023-05-27,20:17,0:47,A,"One of five birds found calling in densely wooded area characterized by Red Cedar and thick deciduous understory on either side of lightly traveled road.

Note: I saw a bird in the road with orange eyeshine but it was not the particular bird that was calling to the best of my knowledge, so I marked that the bird was not seen.",male,uncertain,,Antrostomus_carolinensis_Brush_Creek_Township_near__West_Union_Adams_County_Ohio_804643.mp3,Original Recordings\Antrostomus_carolinensis_Brush_Creek_Township_near__West_Union_Adams_County_Ohio_804643.mp3
178533,Antrostomus,carolinensis,Chuck-will's-widow,38.7638,-83.463,song,2014-05-17,21:00,0:20,B,"Recorded around 9:09pm on 17 May 2014 near the Eulett Center, Edge of Appalachia Preserve (Adams Co. Ohio). Response to my having played a Chuck-wills-widow recording from the Sibley app on my phone. Recorded using a Sony Hi-MD recorder, model MZ-RH910, with a Sennheiser ME67 microphone. Edited later in Audacity (cropped out this section of the recording, high pass filter and noise reduction, and amplification).  Called from nearby dense woods (mixed cedar and deciduous). Temps were on the cool side, but the weather was otherwise pleasant.",,,,Antrostomus_carolinensis_Brush_Creek_near__West_Union_Adams_County_Ohio_178533.mp3,Original Recordings\Antrostomus_carolinensis_Brush_Creek_near__West_Union_Adams_County_Ohio_178533.mp3
929758,Antrostomus,vociferus,Eastern Whip-poor-will,38.6348,-80.5746,song,2024-05-11,19:30,1:13,A,Call was coming from across the lake for hours through the night.,uncertain,uncertain,,Antrostomus_vociferus_Sutton_Braxton_County_West_Virginia_929758.mp3,Original Recordings\Antrostomus_vociferus_Sutton_Braxton_County_West_Virginia_929758.mp3
676768,Chaetura,pelagica,Chimney Swift,39.1196,-84.5989,flight call,2021-09-25,07:55,0:06,B,"Seven birds flying directly overhead, four in tight fighter jet formation. Approaching dusk.",uncertain,uncertain,Turdus migratorius,Chaetura_pelagica_Green_Township_near__Cincinnati_Hamilton_County_Ohio_676768.mp3,Original Recordings\Chaetura_pelagica_Green_Township_near__Cincinnati_Hamilton_County_Ohio_676768.mp3
17058,Chaetura,pelagica,Chimney Swift,41.93338,-83.54994,flight call,2007-06-25,?,0:07,C,,,,Turdus migratorius,Chaetura_pelagica_Michigan_Monroe_County_17058.mp3,Original Recordings\Chaetura_pelagica_Michigan_Monroe_County_17058.mp3
262809,Coccyzus,americanus,Yellow-billed Cuckoo,41.629,-83.194,song,2015-07-19,12:00,1:09,C,Flushed from low shrub.  Had caterpillar in its mouth.  Sang softly while I passed by.,,,,Coccyzus_americanus_Magee_Marsh_boardwalk_west_end_262809.mp3,Original Recordings\Coccyzus_americanus_Magee_Marsh_boardwalk_west_end_262809.mp3
910739,Coccyzus,erythropthalmus,Black-billed Cuckoo,41.9628,-82.5184,call,2023-08-15,12:59,0:07,B,,uncertain,uncertain,Troglodytes aedon,Coccyzus_erythropthalmus_Point_Pelee_National_Park_Essex_County_Ontario_910739.mp3,Original Recordings\Coccyzus_erythropthalmus_Point_Pelee_National_Park_Essex_County_Ontario_910739.mp3
376138,Coccyzus,erythropthalmus,Black-billed Cuckoo,40.9133,-81.4785,song,2017-06-19,07:00,0:09,D,,,,"Cardinalis cardinalis, Melospiza georgiana",Coccyzus_erythropthalmus_Thursby_Rd_near_Singer_Lake_Green_Summit_County_Ohio_376138.mp3,Original Recordings\Coccyzus_erythropthalmus_Thursby_Rd_near_Singer_Lake_Green_Summit_County_Ohio_376138.mp3
476933,Zenaida,macroura,Mourning Dove,41.9296,-82.5092,wings,2019-05-17,16:30,0:09,A,,,,,Zenaida_macroura_Pelee_near__Leamington_Essex_County_Ontario_476933.mp3,Original Recordings\Zenaida_macroura_Pelee_near__Leamington_Essex_County_Ontario_476933.mp3
417850,Rallus,elegans,King Rail,39.919,-83.2065,alarm call,2018-05-06,08:20,0:02,A,Natural vocalization from wet grassy field on windy morning. Revised ID from Virginia to King after comments.,,,,Rallus_elegans_Battelle_Darby_Metro_Park_-_Wetlands_417850.mp3,Original Recordings\Rallus_elegans_Battelle_Darby_Metro_Park_-_Wetlands_417850.mp3
103499,Rallus,elegans,King Rail,40.125,-83.183,call,2011-06-03,12:30pm,0:10,B,"I first found the bird on 3 June after hearing it call in the evening just west of the Honda Wetlands Education Area parking lot.  This recording was made on 4 June 2011 at 12:30pm. No playback was used.  The recording was made using a Sennheiser ME67 shotgun mic and a Sony Hi-MD recorder, model MZ-RH910.  This clip was copied from the original recording using Raven Lite. WAV available for download at http://soundcloud.com/paul-j-hurtado/king-rail-4-june-2011-glacier  eBird Checklist: http://ebird.org/ebird/view/checklist?subID=S8358706",,,,Rallus_elegans_Glacier_Ridge_Metro_Park--Honda_Wetlands_103499.mp3,Original Recordings\Rallus_elegans_Glacier_Ridge_Metro_Park--Honda_Wetlands_103499.mp3
807518,Porzana,carolina,Sora,39.2976,-84.6927,song,2023-05-09,09:32,0:07,A,"Bird called once while I was recording Warbling Vireo. Small pond with marsh vegetation, edged with willow trees and surrounded by medium tall grass field.",uncertain,adult,"Melospiza melodia, Turdus migratorius, Vireo gilvus",Porzana_carolina_Ross_Township_near__Ross_Butler_County_Ohio_807518.mp3,Original Recordings\Porzana_carolina_Ross_Township_near__Ross_Butler_County_Ohio_807518.mp3
417847,Porzana,carolina,Sora,39.919,-83.2065,call,2018-05-06,08:15,0:06,A,Natural vocalization from wet grassy field on windy morning.,,,,Porzana_carolina_Battelle_Darby_Metro_Park_-_Wetlands_417847.mp3,Original Recordings\Porzana_carolina_Battelle_Darby_Metro_Park_-_Wetlands_417847.mp3
417849,Porzana,carolina,Sora,39.919,-83.2065,song,2018-05-06,08:30,0:06,B,Natural vocalization from wet grassy field on windy morning.,,,,Porzana_carolina_Battelle_Darby_Metro_Park_-_Wetlands_417849.mp3,Original Recordings\Porzana_carolina_Battelle_Darby_Metro_Park_-_Wetlands_417849.mp3
625913,Antigone,canadensis,Sandhill Crane,40.3695,-83.0483,alarm call,2021-03-02,11:20,0:32,B,"Pair together, seen while recording was made. For most of the recording the first bird is likely the male (lower pitched voice) a few times alone then the females call is added. There is a series of calls near the middle of the recording where the male and female overlap, male first then female with a slight overlap of the beginning of the female with the end of the male's vocalization. These are the ""guard calls"" of the species, indicating that they were aroused, probably by my presence, however they had been calling before there was a direct line-of-sight view. The birds were across a pond/mudflat approximately 100 to 150 m away.","female, male",adult,Thryothorus ludovicianus,Antigone_canadensis_Troy_Township_near__Delaware_Delaware_County_Ohio_625913.mp3,Original Recordings\Antigone_canadensis_Troy_Township_near__Delaware_Delaware_County_Ohio_625913.mp3
817568,Charadrius,vociferus,Killdeer,41.6275,-83.1897,call,2023-05-16,10:10,0:42,B,calling in flight; fragment; interval shortened at 0:11 and 0:20;,uncertain,adult,Agelaius phoeniceus,Charadrius_vociferus_Magee_Marsh_-_boardwalk_Lucas_County_Ohio_817568.mp3,Original Recordings\Charadrius_vociferus_Magee_Marsh_-_boardwalk_Lucas_County_Ohio_817568.mp3
533371,Charadrius,vociferus,Killdeer,39.3439,-84.6688,flight call,2020-03-08,10:00,0:15,B,,,,,Charadrius_vociferus_Ross_Township_near__Hamilton_Butler_County_Ohio_533371.mp3,Original Recordings\Charadrius_vociferus_Ross_Township_near__Hamilton_Butler_County_Ohio_533371.mp3
17027,Calidris,alpina,Dunlin,41.61422,-83.17215,"call, flock",2007-05-02,?,0:09,D,Flock of about 1000 birds in distance.,,,"Agelaius phoeniceus, Branta canadensis",Calidris_alpina_Ohio_Magee_Marsh_17027.mp3,Original Recordings\Calidris_alpina_Ohio_Magee_Marsh_17027.mp3
837811,Scolopax,minor,American Woodcock,41.9487,-82.5194,song,2023-05-15,21:00,1:48,A,Displaying male,male,,Branta canadensis,Scolopax_minor_Point_Pelee_National_Park_near__Wheatley_Essex_County_Ontario_837811.mp3,Original Recordings\Scolopax_minor_Point_Pelee_National_Park_near__Wheatley_Essex_County_Ontario_837811.mp3
476517,Scolopax,minor,American Woodcock,41.9457,-82.5143,"song, display flight",2019-05-13,21:00,1:01,A,,,,,Scolopax_minor_Pelee_near__Leamington_Essex_County_Ontario_476517.mp3,Original Recordings\Scolopax_minor_Pelee_near__Leamington_Essex_County_Ontario_476517.mp3
418105,Scolopax,minor,American Woodcock,41.6847,-83.395,"flight call, song",2018-05-08,21:40,1:00,A,Natural vocalization of two birds. One is on the ground doing the beent and the other in the air twittering.,,,,Scolopax_minor_Maumee_Bay_SP_Ohio_418105.mp3,Original Recordings\Scolopax_minor_Maumee_Bay_SP_Ohio_418105.mp3
418103,Scolopax,minor,American Woodcock,41.6847,-83.395,song,2018-05-08,21:35,2:20,A,Natural vocalization. Beent and same bird as  XC418099,,,Turdus migratorius,Scolopax_minor_Maumee_Bay_SP_Ohio_418103.mp3,Original Recordings\Scolopax_minor_Maumee_Bay_SP_Ohio_418103.mp3
418101,Scolopax,minor,American Woodcock,41.6847,-83.395,song,2018-05-08,21:30,0:04,A,Natural vocalization. Beent and same bird as  XC418099,,,,Scolopax_minor_Maumee_Bay_SP_Ohio_418101.mp3,Original Recordings\Scolopax_minor_Maumee_Bay_SP_Ohio_418101.mp3
418099,Scolopax,minor,American Woodcock,41.6847,-83.395,"flight call, song",2018-05-08,21:30,2:55,A,Natural vocalization. Both beent and twitter.,,,,Scolopax_minor_Maumee_Bay_SP_Ohio_418099.mp3,Original Recordings\Scolopax_minor_Maumee_Bay_SP_Ohio_418099.mp3
171997,Scolopax,minor,American Woodcock,40.0845,-83.0526,"call, song",2014-03-26,20:15,1:52,B,"Last of three recordings from 26 March 2014 between 8:05-8:20pm, from the north end of the Godown Road Park (Dog Park) on the east side of the OSU Airport area off Godown Rd, Columbus, OH.  There were multiple birds present and calling/displaying, but the recordings focused on one individual ""peent""calling from the ground, then flying off giving twittering areal display calls before (in this recording) returning to the same site (It lands around 0:20 then resumes ""peent""ing).  Shortly after this, around 1:10, a Great Horned Owl flew over, silencing all but one distant bird for at least the next 10 minutes.  Habitat: Mixed brush, sparse trees and heavily impacted grassland mix.
Recording made using a Sennheiser ME67 shotgun mic and a Sony Hi-MD recorder, model MZ-RH910 and cleaned up using Audacity: High Pass filter (2k, 5q, 12db) and noise removal.  
WAV version at https://soundcloud.com/paul-j-hurtado/american-woodcock-3-3.  
eBird Checklist: http://ebird.org/ebird/view/checklist?subID=S17613891",male,,,Scolopax_minor_Columbus_Franklin_County_Ohio_171997.mp3,Original Recordings\Scolopax_minor_Columbus_Franklin_County_Ohio_171997.mp3
171994,Scolopax,minor,American Woodcock,40.0845,-83.0526,"call, song",2014-03-26,20:15,0:52,B,"Second of three recordings from 26 March 2014 between 8:05-8:20pm, from the north end of the Godown Road Park (Dog Park) on the east side of the OSU Airport area off Godown Rd, Columbus, OH.  There were multiple birds present and calling/displaying, but the recordings focused on one individual ""peent""calling from the ground, then (in this recording) flying off giving twittering areal display calls before (not in this recording) returning to the same site.  Habitat: Mixed brush, sparse trees and heavily impacted grassland mix.
Recording made using a Sennheiser ME67 shotgun mic and a Sony Hi-MD recorder, model MZ-RH910 and cleaned up using Audacity: High Pass filter (2k, 5q, 12db) and noise removal.  
WAV version at https://soundcloud.com/paul-j-hurtado/american-woodcock-1-3.  
eBird Checklist: http://ebird.org/ebird/view/checklist?subID=S17613891",male,,Branta canadensis,Scolopax_minor_Columbus_Franklin_County_Ohio_171994.mp3,Original Recordings\Scolopax_minor_Columbus_Franklin_County_Ohio_171994.mp3
171991,Scolopax,minor,American Woodcock,40.0845,-83.0526,"call, song",2014-03-26,20:15,2:41,B,"First of three recordings from the same location on 26 March 2014 between 8:05-8:20pm, from the north end of the Godown Road Park (Dog Park) on the east side of the OSU Airport area off Godown Rd, Columbus, OH.  There were multiple birds present and calling/displaying, but the recordings focused on one individual ""peent""calling from the ground, then flying off giving twittering areal display calls before returning to the same site.  Habitat: Mixed brush, sparse trees and heavily impacted grassland mix.
Recording made using a Sennheiser ME67 shotgun mic and a Sony Hi-MD recorder, model MZ-RH910 and cleaned up using Audacity: High Pass filter (2k, 5q, 12db) and noise removal.  
WAV version at https://soundcloud.com/paul-j-hurtado/american-woodcock-1-3.  
eBird Checklist: http://ebird.org/ebird/view/checklist?subID=S17613891 ",male,,"Melospiza melodia, Turdus migratorius, Cardinalis cardinalis",Scolopax_minor_Columbus_Franklin_County_Ohio_171991.mp3,Original Recordings\Scolopax_minor_Columbus_Franklin_County_Ohio_171991.mp3
473284,Scolopax,minor,American Woodcock,41.949,-82.5193,flight call,2019-05-04,05:04,0:02,C,,,,,Scolopax_minor_Pelee_near__Leamington_Essex_County_Ontario_473284.mp3,Original Recordings\Scolopax_minor_Pelee_near__Leamington_Essex_County_Ontario_473284.mp3
55153,Scolopax,minor,American Woodcock,39.986,-83.02,wing sound,2010-04-02,02:39,0:10,C,Brief wing sound given by presumed overhead migrant.  American Robins singing in the background.  Recorded using automated nocturnal flight call microphone with Knowles element.  Urban residential habitat.,,,Turdus migratorius,Scolopax_minor_Columbus_Ohio_flight_call_recording_station_55153.mp3,Original Recordings\Scolopax_minor_Columbus_Ohio_flight_call_recording_station_55153.mp3
17025,Tringa,solitaria,Solitary Sandpiper,41.62116,-83.16103,call,2007-04-26,?,0:03,C,,,,"Agelaius phoeniceus, Branta canadensis",Tringa_solitaria_Ohio_Crane_Creek_SP_17025.mp3,Original Recordings\Tringa_solitaria_Ohio_Crane_Creek_SP_17025.mp3
17051,Tringa,flavipes,Lesser Yellowlegs,41.61422,-83.17215,"call, song",2007-05-02,?,0:05,B,,,,,Tringa_flavipes_Ohio_Magee_Marsh_17051.mp3,Original Recordings\Tringa_flavipes_Ohio_Magee_Marsh_17051.mp3
17050,Tringa,flavipes,Lesser Yellowlegs,41.61422,-83.17215,call,2007-05-02,?,0:08,B,,,,Charadrius vociferus,Tringa_flavipes_Ohio_Magee_Marsh_17050.mp3,Original Recordings\Tringa_flavipes_Ohio_Magee_Marsh_17050.mp3
17049,Tringa,flavipes,Lesser Yellowlegs,41.61422,-83.17215,call,2007-05-02,?,0:10,B,,,,"Agelaius phoeniceus, Branta canadensis",Tringa_flavipes_Ohio_Magee_Marsh_17049.mp3,Original Recordings\Tringa_flavipes_Ohio_Magee_Marsh_17049.mp3
17048,Tringa,flavipes,Lesser Yellowlegs,41.61422,-83.17215,call,2007-05-02,?,0:03,B,,,,Agelaius phoeniceus,Tringa_flavipes_Ohio_Magee_Marsh_17048.mp3,Original Recordings\Tringa_flavipes_Ohio_Magee_Marsh_17048.mp3
17047,Tringa,flavipes,Lesser Yellowlegs,41.61422,-83.17215,call,2007-05-02,?,0:17,B,,,,"Agelaius phoeniceus, Setophaga aestiva, Branta canadensis, Charadrius vociferus",Tringa_flavipes_Ohio_Magee_Marsh_17047.mp3,Original Recordings\Tringa_flavipes_Ohio_Magee_Marsh_17047.mp3
839507,Chroicocephalus,philadelphia,Bonaparte's Gull,41.9088,-82.509,call,2023-05-16,09:00,0:59,B,,,,Agelaius phoeniceus,Chroicocephalus_philadelphia_Point_Pelee_National_Park_near__Wheatley_Essex_County_Ontario_839507.mp3,Original Recordings\Chroicocephalus_philadelphia_Point_Pelee_National_Park_near__Wheatley_Essex_County_Ontario_839507.mp3
11860,Larus,delawarensis,Ring-billed Gull,41.9162,-83.3387,call,2007-03-15,?,0:37,C,,,,,Larus_delawarensis_Michigan_Sterling_SP_11860.mp3,Original Recordings\Larus_delawarensis_Michigan_Sterling_SP_11860.mp3
476265,Chlidonias,niger,Black Tern,41.9628,-82.5184,call,2019-05-13,14:00,0:11,B,,,,Agelaius phoeniceus,Chlidonias_niger_Pelee_near__Leamington_Essex_County_Ontario_476265.mp3,Original Recordings\Chlidonias_niger_Pelee_near__Leamington_Essex_County_Ontario_476265.mp3
417864,Botaurus,lentiginosus,American Bittern,39.919,-83.2065,song,2018-05-06,08:55,0:09,A,Natural vocalization from wet grassy field on windy morning.,,,,Botaurus_lentiginosus_Battelle_Darby_Metro_Park_-_Wetlands_417864.mp3,Original Recordings\Botaurus_lentiginosus_Battelle_Darby_Metro_Park_-_Wetlands_417864.mp3
417863,Botaurus,lentiginosus,American Bittern,39.919,-83.2065,song,2018-05-06,08:50,0:04,B,Natural vocalization from wet grassy field on windy morning.,,,,Botaurus_lentiginosus_Battelle_Darby_Metro_Park_-_Wetlands_417863.mp3,Original Recordings\Botaurus_lentiginosus_Battelle_Darby_Metro_Park_-_Wetlands_417863.mp3
417855,Botaurus,lentiginosus,American Bittern,39.919,-83.2065,song,2018-05-06,08:40,0:07,C,Natural vocalization from wet grassy field on windy morning.,,,"Agelaius phoeniceus, Melospiza melodia, Geothlypis trichas, Cistothorus palustris, Botaurus lentiginosus",Botaurus_lentiginosus_Battelle_Darby_Metro_Park_-_Wetlands_417855.mp3,Original Recordings\Botaurus_lentiginosus_Battelle_Darby_Metro_Park_-_Wetlands_417855.mp3
17012,Ardea,alba,Great Egret,41.6156,-83.21604,call,2007-04-26,?,0:06,B,,,,Agelaius phoeniceus,Ardea_alba_Ohio_Ottawa_NWR_17012.mp3,Original Recordings\Ardea_alba_Ohio_Ottawa_NWR_17012.mp3
17115,Accipiter,cooperii,Cooper's Hawk,41.93338,-83.54994,"call, calls",2007-07-16,?,0:25,B,Two recently fledged juveniles begging,,juvenile,Cardinalis cardinalis,Accipiter_cooperii_Michigan_Monroe_County_17115.mp3,Original Recordings\Accipiter_cooperii_Michigan_Monroe_County_17115.mp3
809281,Buteo,lineatus,Red-shouldered Hawk,39.1767,-84.6557,call,2023-06-16,09:23,0:54,A,"Immature bird perched in elm with grapevine tangle, then moving to a bare branch of a dead ash or walnut. Habitat is a suburban area surrounded by small patches of woodland and hedgerows with scattered trees in semi-open.",uncertain,juvenile,"Melospiza melodia, Turdus migratorius",Buteo_lineatus_Green_Township_near__Cincinnati_Hamilton_County_Ohio_809281.mp3,Original Recordings\Buteo_lineatus_Green_Township_near__Cincinnati_Hamilton_County_Ohio_809281.mp3
691446,Buteo,lineatus,Red-shouldered Hawk,39.283,-84.7459,call,2021-12-14,07:48,0:23,A,Bird began calling after photos taken. Continued calling after flying from tall deciduous tree overlooking marsh.,uncertain,adult,"Spinus tristis, Cardinalis cardinalis",Buteo_lineatus_Miami_Whitewater_Forest_Park_wetlands_Crosby_Township_near__Harrison_Hamilton_County_Ohio_691446.mp3,Original Recordings\Buteo_lineatus_Miami_Whitewater_Forest_Park_wetlands_Crosby_Township_near__Harrison_Hamilton_County_Ohio_691446.mp3
673003,Buteo,lineatus,Red-shouldered Hawk,39.1722,-84.643,call,2021-09-07,11:00,0:09,A,One of three birds. Only one calling at a time in recording. One silently flying overhead. (I marked bird seen:no because the one that was calling remained hidden in the leaves. The one seen was not the one calling. Noise reduction but no high-pass filter.,uncertain,,"Spinus tristis, Contopus virens",Buteo_lineatus_Green_Township_near__Cincinnati_Hamilton_County_Ohio_673003.mp3,Original Recordings\Buteo_lineatus_Green_Township_near__Cincinnati_Hamilton_County_Ohio_673003.mp3
44321,Buteo,lineatus,Red-shouldered Hawk,39.192,-84.555,call,2006-02-25,10:30,0:13,A,while soaring,,,"Turdus migratorius, Cardinalis cardinalis",Buteo_lineatus_Tanglewood_Lane_Cincinnati_Ohio_44321.mp3,Original Recordings\Buteo_lineatus_Tanglewood_Lane_Cincinnati_Ohio_44321.mp3
477606,Buteo,lineatus,Red-shouldered Hawk,39.5734,-84.0131,call,2019-05-15,12:30,0:07,C,Natural vocalization,,,Vireo flavifrons,Buteo_lineatus_Spring_Valley_near__Waynesville_Greene_Cty_Ohio_477606.mp3,Original Recordings\Buteo_lineatus_Spring_Valley_near__Waynesville_Greene_Cty_Ohio_477606.mp3
17118,Buteo,lineatus,Red-shouldered Hawk,41.93338,-83.54994,call,2007-07-16,?,0:34,D,Adult with fledged young; traffic noise in background,,,"Cardinalis cardinalis, Cyanocitta cristata",Buteo_lineatus_Michigan_Monroe_County_17118.mp3,Original Recordings\Buteo_lineatus_Michigan_Monroe_County_17118.mp3
17117,Buteo,jamaicensis,Red-tailed Hawk,41.93338,-83.54994,"call, calls",2007-07-18,?,0:26,B,Recently fledged young begging,,juvenile,"Sialia sialis, Passer domesticus",Buteo_jamaicensis_Michigan_Monroe_County_17117.mp3,Original Recordings\Buteo_jamaicensis_Michigan_Monroe_County_17117.mp3
17116,Buteo,jamaicensis,Red-tailed Hawk,41.93338,-83.54994,call,2007-07-16,?,0:35,B,,,,"Agelaius phoeniceus, Spinus tristis, Turdus migratorius",Buteo_jamaicensis_Michigan_Monroe_County_17116.mp3,Original Recordings\Buteo_jamaicensis_Michigan_Monroe_County_17116.mp3
580333,Tyto,furcata,American Barn Owl,41.1339,-81.4846,"flight call, nocturnal flight call",2020-08-01,03:30,0:03,A,"Nocturnal flight call, the loudest one of three in a series of similar calls over a couple minutes. The calls before and after this were fainter, indicating that it was flying overhead.  The microphone is an Oldbird 21c setup on our roof to record nocturnal flight calls.",uncertain,uncertain,,Tyto_furcata_Cuyahoga_Falls_Summit_County_Ohio_580333.mp3,Original Recordings\Tyto_furcata_Cuyahoga_Falls_Summit_County_Ohio_580333.mp3
